<!ELEMENT TimeTable (course+)>
<!ELEMENT course (name, teacher, time, begin, end)> 
<!ELEMENT name (#PCDATA)> 
<!ELEMENT teacher (#PCDATA)> 
<!ELEMENT time (#PCDATA)> 
<!ELEMENT begin (#PCDATA)> 
<!ELEMENT end (#PCDATA)> 
